{
  "version": "1.0.0",
  "updated": "2026-10-11",
  "note": "Documented creator-business deconstructions. Figures are reported by the cited sources, not audited, never present as promises.",
  "case_files": [
    {
      "id": "case-budget-grocery",
      "badge": "Case File",
      "title": "The Budget-Grocery Newsletter",
      "path": "case-budget-grocery.html",
      "words": 684,
      "read_minutes": 3
    },
    {
      "id": "case-bens-bites",
      "badge": "Case File",
      "title": "Ben's Bites",
      "path": "case-bens-bites.html",
      "words": 750,
      "read_minutes": 4
    },
    {
      "id": "case-sleep-channels",
      "badge": "Case File",
      "title": "The Sleep-Channel Network",
      "path": "case-sleep-channels.html",
      "words": 800,
      "read_minutes": 4
    },
    {
      "id": "case-mavwicks",
      "badge": "Case File",
      "title": "Mavwicks on TikTok Shop",
      "path": "case-mavwicks.html",
      "words": 791,
      "read_minutes": 4
    },
    {
      "id": "case-ptya",
      "badge": "Case File",
      "title": "The Cohort Course",
      "path": "case-ptya.html",
      "words": 853,
      "read_minutes": 4
    },
    {
      "id": "case-poly-couple",
      "badge": "Case File",
      "title": "The Poly Couple",
      "path": "case-poly-couple.html",
      "words": 1137,
      "read_minutes": 6
    },
    {
      "id": "case-gibi-asmr",
      "badge": "Case File",
      "title": "Gibi ASMR",
      "path": "case-gibi-asmr.html",
      "words": 1155,
      "read_minutes": 6
    },
    {
      "id": "case-clippers-squeeze",
      "badge": "Case File",
      "title": "The Clipping Squeeze",
      "path": "case-clippers-squeeze.html",
      "words": 1130,
      "read_minutes": 6
    },
    {
      "id": "case-shorts-floor",
      "badge": "Case File",
      "title": "The Monthly Floor",
      "path": "case-shorts-floor.html",
      "words": 1241,
      "read_minutes": 6
    }
  ]
}